id,conversation_id,created_at,date,time,timezone,user_id,username,name,place,tweet,language,mentions,urls,photos,replies_count,retweets_count,likes_count,hashtags,cashtags,link,retweet,quote_url,video,thumbnail,near,geo,source,user_rt_id,user_rt,retweet_id,reply_to,retweet_date,translate,trans_src,trans_dest
1053113684661338113,1053113684661338113,2018-10-19 08:10:42 IST,2018-10-19,08:10:42,+0530,28082599,rajeev_goi,Rajeev Chandrasekhar 🇮🇳,,"This ques by @ShefVaidya has to be asked n answrd by not just SC but also pol ldrs like @vijayanpinarayi   Is Hindu Anger n Pain less imprtnt thn othr faiths?   Im a Hindu, I worship #Ayyappa. I dont mix politcs n religion. but i blv in Self-Respect n being heard.  #Sabarimala",en,"[{'screen_name': 'shefvaidya', 'name': 'shefali vaidya. 🇮🇳', 'id': '1934388686'}, {'screen_name': 'vijayanpinarayi', 'name': 'pinarayi vijayan', 'id': '2707179805'}]",[],[],157,777,1548,"['ayyappa', 'sabarimala']",[],https://twitter.com/Rajeev_GoI/status/1053113684661338113,False,https://twitter.com/ShefVaidya/status/1053111134499139584,0,,,,,,,,[],,,,
1053112483362234368,1053112483362234368,2018-10-19 08:05:56 IST,2018-10-19,08:05:56,+0530,1934388686,shefvaidya,Shefali Vaidya. 🇮🇳,,"Amidst all the gloom of police atrocities on the pilgrims at #Sabarimala, and the absolute shamelessness and lies of library women journalists, there is only one silver lining, #Sabarimala is uniting the Hindus of Kerala as never before. #SwamiyeSharanamAyyappa",en,[],[],[],77,613,1515,"['sabarimala', 'sabarimala', 'swamiyesharanamayyappa']",[],https://twitter.com/ShefVaidya/status/1053112483362234368,False,,0,,,,,,,,[],,,,
1053111134499139584,1053111134499139584,2018-10-19 08:00:34 IST,2018-10-19,08:00:34,+0530,1934388686,shefvaidya,Shefali Vaidya. 🇮🇳,,"SC judges have waxed eloquent about how 'dissent is the safety valve of democracy'. Do they not see the sea of women out on the streets in #Kerala, peacefully protesting against the #Sabarimala verdict? Only Maoist hatred of India conspiracies qualifies as valid dissent?",en,[],[],[],156,2312,4173,"['kerala', 'sabarimala']",[],https://twitter.com/ShefVaidya/status/1053111134499139584,False,,0,,,,,,,,[],,,,
1053103034383785984,1053103034383785984,2018-10-19 07:28:23 IST,2018-10-19,07:28:23,+0530,1934388686,shefvaidya,Shefali Vaidya. 🇮🇳,,"What LIES? Where exactly is the stone pelting in this video? All I see is a sniggering woman, deliberately trampling on the emotions of the pilgrims. Why doesn't the SC in all its wisdom, put a gag order on media and end this cheap media circus at #Sabarimala?",en,[],[],[],91,835,1289,['sabarimala'],[],https://twitter.com/ShefVaidya/status/1053103034383785984,False,https://twitter.com/ndtv/status/1052771311024365570,0,,,,,,,,[],,,,
1053035963444793345,1053035963444793345,2018-10-19 03:01:52 IST,2018-10-19,03:01:52,+0530,69539409,neha_aks,नेहा श्रीवास्तव (Nehā S),,So is media totally blacking out that the crazy woman Trupti Desai  is sneaking into #Sabarimala to confuse protestors and keep them in the dark? #SaveSabarimala,en,[],[],[],8,97,144,"['sabarimala', 'savesabarimala']",[],https://twitter.com/neha_aks/status/1053035963444793345,False,,0,,,,,,,,[],,,,
1052992066114981889,1052992066114981889,2018-10-19 00:07:26 IST,2018-10-19,00:07:26,+0530,56039856,abhijitmajumder,Abhijit Majumder,,"Hope #Sabarimala protests will turn nation’s focus to not just Kerala but all of south India. In the name of securalism and Aryan-Dravidian bogey, govts have meddled with temples, allowed unbridled conversion and Islamist terror hubs, PFI. Almost all ISIS arrests were from south.",en,[],[],[],27,883,1506,['sabarimala'],[],https://twitter.com/abhijitmajumder/status/1052992066114981889,False,,0,,,,,,,,[],,,,
1052990495981494273,1052990495981494273,2018-10-19 00:01:12 IST,2018-10-19,00:01:12,+0530,894499624546971648,templefable,Kerala Temple History,,Dear devotees of North India. We know it's a little bit difficult for you to visit #Sabarimala during festivities. But do mark your solidarity  this #Dussehra by burning home-made effigies of Ravan which has face of  P........ ( You know who). Share video. #SaveSabarimala,en,[],[],[],33,377,585,"['sabarimala', 'dussehra', 'savesabarimala']",[],https://twitter.com/templefable/status/1052990495981494273,False,,0,,,,,,,,[],,,,
1052969737662025728,1052969737662025728,2018-10-18 22:38:43 IST,2018-10-18,22:38:43,+0530,234811860,gopalee67,Prof.S.Venugopalan🇮🇳,,"While #Sabarimala issue is raging elsewhere, an EB lineman performs his Āyudhapūjā on this #mahanavami day in an unknown place. Hinduism lives here practically. @sgurumurthy @rvaidya2000  https://t.co/l9iixdV30F",en,"[{'screen_name': 'sgurumurthy', 'name': 's gurumurthy', 'id': '129057534'}, {'screen_name': 'rvaidya2000', 'name': 'rvaidya2000', 'id': '108006063'}]",[],['https://pbs.twimg.com/media/DpzmY4OU8AAmS0O.jpg'],11,175,429,"['sabarimala', 'mahanavami']",[],https://twitter.com/Gopalee67/status/1052969737662025728,False,,1,https://pbs.twimg.com/media/DpzmY4OU8AAmS0O.jpg,,,,,,,[],,,,
1052962338515668992,909046883519127552,2018-10-18 22:09:19 IST,2018-10-18,22:09:19,+0530,28082599,rajeev_goi,Rajeev Chandrasekhar 🇮🇳,,The #Sabarimala thantri appeals to young women not to come   I also appeal to media channels to be more sensitive in reporting - Ayyappa devotees are upset and angry ! Avoid provoctve covrage pls 🙏🏻Respect Hindu devotees just as you do othrs    https://t.co/pd2qZukGMj,en,[],['https://timesofindia.indiatimes.com/india/sabarimala-head-priest-appeals-to-young-women-not-to-visit-hill-shrine/articleshow/66274882.cms'],[],47,148,273,['sabarimala'],[],https://twitter.com/Rajeev_GoI/status/1052962338515668992,False,,0,,,,,,,,[],,,,
1052959774118096896,1052959774118096896,2018-10-18 21:59:07 IST,2018-10-18,21:59:07,+0530,282483076,jayadeep333,Jayadeep Kotian 🇮🇳,,"Many hates Dr Subramanian @Swamy39 ji on his straight talk, but it really needs guts to speak truth at any moment. #Sabarimala",en,"[{'screen_name': 'swamy39', 'name': 'subramanian swamy', 'id': '60937837'}]",[],[],30,73,377,['sabarimala'],[],https://twitter.com/Jayadeep333/status/1052959774118096896,False,,0,,,,,,,,[],,,,
1052954723370692609,1052954723370692609,2018-10-18 21:39:03 IST,2018-10-18,21:39:03,+0530,17843247,deepsealioness,‎ 🇵🇸 پربھا 🚜 🏳️‍🌈,,"Stone pelters in Kashmir?  Sanghis: Anti national   Stone pelters in Tamil Nadu? Sanghis: Anti National   Sanghi Stone pelters in #Sabarimala?  Sanghis: We are protecting our religion, our constitutional right to protest is being silenced, our feelings are so hurt  Okay then 🙄",en,[],[],[],45,635,1408,['sabarimala'],[],https://twitter.com/deepsealioness/status/1052954723370692609,False,,0,,,,,,,,[],,,,
1052954123870580737,1052954123870580737,2018-10-18 21:36:40 IST,2018-10-18,21:36:40,+0530,56039856,abhijitmajumder,Abhijit Majumder,,He calls angry #Sabarimala devotees terrorists. It’s good that masks are coming off :-),en,[],[],[],6,83,168,['sabarimala'],[],https://twitter.com/abhijitmajumder/status/1052954123870580737,False,https://twitter.com/drthomasisaac/status/1052570249227169792,0,,,,,,,,[],,,,
1052950004241977344,1052950004241977344,2018-10-18 21:20:18 IST,2018-10-18,21:20:18,+0530,49877768,surnell,Suresh N 🇮🇳,,#ALERT It is being informed that #TruptiDesai Obstructor Par Excellence is planning on going up the #Sabarimala tonight. Commie Governments treating it as prestige issue and is planning a heavy deployment of Escorts cc: @RahulEaswar #SaveSabarimalaTradition,en,"[{'screen_name': 'rahuleaswar', 'name': 'rahul easwar', 'id': '57207846'}]",[],[],52,324,274,"['alert', 'truptidesai', 'sabarimala', 'savesabarimalatradition']",[],https://twitter.com/surnell/status/1052950004241977344,False,,0,,,,,,,,[],,,,
1052931803957215233,1052931803957215233,2018-10-18 20:07:59 IST,2018-10-18,20:07:59,+0530,103805033,sureshchavhanke,Suresh Chavhanke “Sudarshan News”,,#Sabarimala पर अध्यादेश लाओ..बात नारी समानता नहीं आस्था की है.. #Jansansad  https://t.co/zpfGaNeKpK,hi,[],['https://www.pscp.tv/w/bpiSRzFBbVF6Z2xtcW56S2V8MXlvSk1Wb1JCUHd4UUCIiLk82RvY5e0GpT_3pUbsdEjgSOUeM4fHytsNEGU9'],[],37,279,780,"['sabarimala', 'jansansad']",[],https://twitter.com/SureshChavhanke/status/1052931803957215233,False,,0,,,,,,,,[],,,,
1052927221696991233,1052927221696991233,2018-10-18 19:49:46 IST,2018-10-18,19:49:46,+0530,539146851,moksha1937,Rahul,,"#RSSVijayaDashami A procession by ""Durga Vahini"" in #Kerala. Marching like a real #avatara of Ma #Durga is a signal enough to send shivers down the spine of #commies. Let's Salute Bharat Mata, #women #power @RSSorg #Sabarimala #RSS #RSSVajayaDashami #RSS4Bharat #rsspirit  https://t.co/uyyg5YobI2",en,"[{'screen_name': 'rssorg', 'name': 'rss', 'id': '310239584'}]",[],[],21,198,346,"['rssvijayadashami', 'kerala', 'avatara', 'durga', 'commies', 'women', 'power', 'sabarimala', 'rss', 'rssvajayadashami', 'rss4bharat', 'rsspirit']",[],https://twitter.com/Moksha1937/status/1052927221696991233,False,,1,https://pbs.twimg.com/ext_tw_video_thumb/1052927002808856579/pu/img/i3xJ0EZ-Jlua9961.jpg,,,,,,,[],,,,
1052913453730390016,1052913453730390016,2018-10-18 18:55:04 IST,2018-10-18,18:55:04,+0530,1545571488,sujuhyd,sujapavithran,,Thousands of devotees supporting the #Sabarimala Karma Samithi's Hartal. #NamaJapaYatra  #Thrissur  https://t.co/RfiZwk3FCZ,en,[],[],[],32,586,922,"['sabarimala', 'namajapayatra', 'thrissur']",[],https://twitter.com/sujuhyd/status/1052913453730390016,False,,1,https://pbs.twimg.com/ext_tw_video_thumb/1052913291306180608/pu/img/3NbauyLIaNv-9OPR.jpg,,,,,,,[],,,,
1052877090859577344,1052877090859577344,2018-10-18 16:30:34 IST,2018-10-18,16:30:34,+0530,836856888574816256,indusscrolls,Indus Scrolls,,#SabarimalaTemple Monster cop Manoj Abraham behind police atrocities in #Sabarimala  https://t.co/PuOMRNHUWg  https://t.co/gEmc9I8XYD,en,[],['http://www.indusscrolls.com/monster-cop-manoj-abraham-behind-police-atrocities-in-sabarimala/'],['https://pbs.twimg.com/media/DpyR_QeU0AAiAdA.jpg'],44,427,309,"['sabarimalatemple', 'sabarimala']",[],https://twitter.com/indusscrolls/status/1052877090859577344,False,,1,https://pbs.twimg.com/media/DpyR_QeU0AAiAdA.jpg,,,,,,,[],,,,
1052873031981256704,1052873031981256704,2018-10-18 16:14:26 IST,2018-10-18,16:14:26,+0530,351568421,mrvchennai,MRV,,One ingenious way to settle #Sabarimala is make Bishop Franko melshanthi - it will deter women to go there and also uphold equality b4 law.,en,[],[],[],36,138,339,['sabarimala'],[],https://twitter.com/MRVChennai/status/1052873031981256704,False,,0,,,,,,,,[],,,,
1052870175861616640,1052870175861616640,2018-10-18 16:03:05 IST,2018-10-18,16:03:05,+0530,458353778,shrialokmishra,Alok Mishra,,फिलिस्तीन पर दुनिया का हर मुस्लिम उसके साथ है । सबरी माला के मुद्दे पर केरल के बाहर के हिन्दुओं की चुप्पी शर्मनाक है....... #Sabarimala,hi,[],[],[],3,73,166,['sabarimala'],[],https://twitter.com/shrialokmishra/status/1052870175861616640,False,,0,,,,,,,,[],,,,
1052863683129294849,1052863683129294849,2018-10-18 15:37:17 IST,2018-10-18,15:37:17,+0530,1934388686,shefvaidya,Shefali Vaidya. 🇮🇳,,"Dear libtard women, If you believe in Ayyappa, you must believe in His right to observe #naishthikabrahmcharya as well. If you do NOT believe in Ayyappa, why do you even want to go to #sabarimala?",en,[],[],[],231,2418,6045,"['naishthikabrahmcharya', 'sabarimala']",[],https://twitter.com/ShefVaidya/status/1052863683129294849,False,,0,,,,,,,,[],,,,
1052863312621445120,1052863312621445120,2018-10-18 15:35:49 IST,2018-10-18,15:35:49,+0530,49877768,surnell,Suresh N 🇮🇳,,"#SaveSabarimalaTradition Hear this! She stays just 6kms from #Sabarimala and honoring the will of Lord Ayyappa has never gone. ""WE WILL NEVER ALLOW ANY LADY BETWEEN 10-50 years, If they try, they will not go back"" Never mess with Lord Ayyappa &amp; these devout ladies. SwamiSharanam  https://t.co/Lj2E81nPtI",en,[],[],[],18,384,522,"['savesabarimalatradition', 'sabarimala']",[],https://twitter.com/surnell/status/1052863312621445120,False,,1,https://pbs.twimg.com/ext_tw_video_thumb/1052862993384517632/pu/img/pXyQro6Vz7lsMMzB.jpg,,,,,,,[],,,,
1052851621674266625,1052851621674266625,2018-10-18 14:49:22 IST,2018-10-18,14:49:22,+0530,1419020654,ishkarnbhandari,Ishkaran Singh Bhandari,,"Have been called on many debates on #Sabarimala have refused to go on any, cause many channels using it to attack Hinduism.  My view is-   Govt should bring Notification on #sabarimala restoring centuries old custom for a month &amp; then discuss with all stakeholders &amp; make decision",en,[],[],[],58,568,1161,"['sabarimala', 'sabarimala']",[],https://twitter.com/ishkarnBHANDARI/status/1052851621674266625,False,,0,,,,,,,,[],,,,
1052847775254175744,1052847775254175744,2018-10-18 14:34:05 IST,2018-10-18,14:34:05,+0530,1004026492693594112,subalternkaimal,Subaltern Kaimal,,"We are busy with finding a route to bring our lost karyakartas from the #Sabarimala forest, who were fighting to protect Lord Ayyappa's 'celibacy'.  (Videos of veer sanghputras fleeing are not true. They went to the forest to bring the holy tiger to fight against the libtards)  https://t.co/G6xc7RFt2M",en,[],[],[],5,141,371,['sabarimala'],[],https://twitter.com/SubalternKaimal/status/1052847775254175744,False,,1,https://pbs.twimg.com/ext_tw_video_thumb/1052847568294539264/pu/img/YCBUQNTEXiuSU1fB.jpg,,,,,,,[],,,,
1052847459532201985,1052847459532201985,2018-10-18 14:32:49 IST,2018-10-18,14:32:49,+0530,28082599,rajeev_goi,Rajeev Chandrasekhar 🇮🇳,,Dear @CMOKerala @vijayanpinarayi - Dnt just sit n watch ths havoc unfold. Apprch SC n hv it stay judgmnt n allw anger to cool n revw judgmnt. 1981 SC judgmnt of Shia vs Sunni stll held in abeyance fr 37yrs in intrst of peace.   Why not #Sabarimala or is Hindu anger not feared?😡,en,"[{'screen_name': 'cmokerala', 'name': 'cmo kerala', 'id': '737583593245937664'}, {'screen_name': 'vijayanpinarayi', 'name': 'pinarayi vijayan', 'id': '2707179805'}]",[],[],134,545,834,['sabarimala'],[],https://twitter.com/Rajeev_GoI/status/1052847459532201985,False,https://twitter.com/Rajeev_GoI/status/1052039840420777984,0,,,,,,,,[],,,,
1052835882850340866,1052835882850340866,2018-10-18 13:46:49 IST,2018-10-18,13:46:49,+0530,129057534,sgurumurthy,S Gurumurthy,,This is the kind of women who are devotees longing to see Ayyappa for whom the SC opened the doors and liberals desecrated the #sabarimala tradition. Not a single woman who worships Ayyappa would ever violate HIS tradition. Egoitic liberals wanting to make a point are damaging it,en,[],[],[],32,286,461,['sabarimala'],[],https://twitter.com/sgurumurthy/status/1052835882850340866,False,https://twitter.com/srirama74/status/1052834525632323590,0,,,,,,,,[],,,,
1052835241377841152,1052835241377841152,2018-10-18 13:44:16 IST,2018-10-18,13:44:16,+0530,1934388686,shefvaidya,Shefali Vaidya. 🇮🇳,,"After the brutal repression of #Sabarimala pilgrims and the way Bishop Franco was welcomed, I was so dejected when I went to Kali Bari for Darshan. Then I saw her, the Mother, and the anguished expression on Mahishasura. Someday, #Shakti WILL prevail. Till then, keep fighting!!  https://t.co/c7HJ785yy4",en,[],[],['https://pbs.twimg.com/media/DpxsDc-U0AEqxgw.jpg'],32,237,738,"['sabarimala', 'shakti']",[],https://twitter.com/ShefVaidya/status/1052835241377841152,False,,1,https://pbs.twimg.com/media/DpxsDc-U0AEqxgw.jpg,,,,,,,[],,,,
1052826747228413952,1052826747228413952,2018-10-18 13:10:31 IST,2018-10-18,13:10:31,+0530,351568421,mrvchennai,MRV,,I M glad that @RSSorg has made its stand absolutely clear on #Sabarimala . Now for @BJP4India to make its stand clear &amp; explore constitutional mechanisms to undo the perfidy caused by SC judgement.,en,"[{'screen_name': 'rssorg', 'name': 'rss', 'id': '310239584'}, {'screen_name': 'bjp4india', 'name': 'bjp', 'id': '207809313'}]",[],[],33,279,485,['sabarimala'],[],https://twitter.com/MRVChennai/status/1052826747228413952,False,,0,,,,,,,,[],,,,
1052824583777255424,909046883519127552,2018-10-18 13:01:55 IST,2018-10-18,13:01:55,+0530,28082599,rajeev_goi,Rajeev Chandrasekhar 🇮🇳,,The #Sabarimala issue is not about discrimination - its about faith n tradition of many #Ayyappa devotees. It must be handled wth the sensitivity it desrves 🙏🏻 #SwamiSharanam   @CMOKerala @vijayanpinarayi    https://t.co/ApGZoXzVfK,en,"[{'screen_name': 'cmokerala', 'name': 'cmo kerala', 'id': '737583593245937664'}, {'screen_name': 'vijayanpinarayi', 'name': 'pinarayi vijayan', 'id': '2707179805'}]",['https://theprint.in/opinion/i-oppose-sabarimala-verdict-because-this-is-not-about-womens-discrimination-at-all/136444/'],[],52,191,396,"['sabarimala', 'ayyappa', 'swamisharanam']",[],https://twitter.com/Rajeev_GoI/status/1052824583777255424,False,,0,,,,,,,,[],,,,
1052819283971956737,1052819283971956737,2018-10-18 12:40:52 IST,2018-10-18,12:40:52,+0530,129057534,sgurumurthy,S Gurumurthy,,"This is the extent to which liberals, left, non believers in Ayyappan for whom going to #sabarimala is exotic &amp; popular picnic spot (not a place of reverence) have reduced the Ayyappa devotees to ...to commit suicide. The SC is happy it has done Statistical gender justice.",en,[],[],[],50,584,729,['sabarimala'],[],https://twitter.com/sgurumurthy/status/1052819283971956737,False,https://twitter.com/HKupdate/status/1052514298704977920,0,,,,,,,,[],,,,
1052811816454119424,1052811816454119424,2018-10-18 12:11:11 IST,2018-10-18,12:11:11,+0530,52437155,rajeevsrinivasa,Prof राजीवः श्रीनिवासः,,Why #sabarimala is under attack. Church wants the entire western ghats.,en,[],[],[],7,223,170,['sabarimala'],[],https://twitter.com/RajeevSrinivasa/status/1052811816454119424,False,https://twitter.com/NarenMenon1/status/1052809969735622656,0,,,,,,,,[],,,,
1052807610506842112,1052807610506842112,2018-10-18 11:54:29 IST,2018-10-18,11:54:29,+0530,2261350952,prafullaketkar,prafulla ketkar 🇮🇳,,"Clearing Misconceptions On #Sabarimala : Real women devotees of Lord Ayyappa in Kerala and South India have never felt that their right to pray at Sabarimala temple has ever stood violated. Therefore the recent angst and rage, #SabarimalaTemple   https://t.co/4lFsw9JNbz",en,[],['http://www.organiser.org/Encyc/2018/10/17/Clearing-Misconceptions-Regarding-the-Sabarimala-Temple-Tradition.html'],[],5,104,142,"['sabarimala', 'sabarimalatemple']",[],https://twitter.com/prafullaketkar/status/1052807610506842112,False,,0,,,,,,,,[],,,,
1052806455554859008,1052806455554859008,2018-10-18 11:49:53 IST,2018-10-18,11:49:53,+0530,906105384854630400,ethirajans,Ethirajan Srinivasan 🇮🇳🚩,,"I have a simple question to Self Proclaimed Virat Hindus from TN who bat for women's entry into #Sabarimala, what if Mahila Samaj approaches Court claiming equal rights to succeed Kanchi Acharya Peetham? Do you have diff scale or will fight for establishing equality there too?",en,[],[],[],37,145,287,['sabarimala'],[],https://twitter.com/Ethirajans/status/1052806455554859008,False,,0,,,,,,,,[],,,,
1052802052772904961,1052802052772904961,2018-10-18 11:32:24 IST,2018-10-18,11:32:24,+0530,1358917686,mariawirth1,Maria Wirth,,"Am glad that the great majority of Indians never watch Engl news channels. Yet politics seems to get greatly influenced by them. Why? Is the Engl speaking ""modern"" section of Indians more important? Just look West and see whether you want our type of ""culture"". #Sabarimala #MeToo",en,[],[],[],23,240,520,"['sabarimala', 'metoo']",[],https://twitter.com/mariawirth1/status/1052802052772904961,False,,0,,,,,,,,[],,,,
1052795336471674880,1052795336471674880,2018-10-18 11:05:42 IST,2018-10-18,11:05:42,+0530,894499624546971648,templefable,Kerala Temple History,,"WATCH! Explosive video. The woman who got hurt in the pelting yesterday, clearly says it was Kerala Police who threw stones at her!!!   #SaveSabarimala #SabarimalaTemple #Sabarimala @HKupdate @Kuvalayamala @lotophagus  @jaypanicker   Received via WA  https://t.co/0Ibpe55ChI",en,"[{'screen_name': 'hkupdate', 'name': 'hkupdate', 'id': '2397405540'}, {'screen_name': 'kuvalayamala', 'name': '🍿', 'id': '1611887712'}, {'screen_name': 'lotophagus', 'name': 'padma pillai', 'id': '4015086132'}, {'screen_name': 'jaypanicker', 'name': 'jayashankar', 'id': '85330272'}]",[],[],22,665,491,"['savesabarimala', 'sabarimalatemple', 'sabarimala']",[],https://twitter.com/templefable/status/1052795336471674880,False,,1,https://pbs.twimg.com/ext_tw_video_thumb/1052794949811523585/pu/img/vRLRlZIjaU9RNOV4.jpg,,,,,,,[],,,,
1052791772001263616,1052791772001263616,2018-10-18 10:51:33 IST,2018-10-18,10:51:33,+0530,55313371,nach1keta,നചികേതസ്,,"Pic1 -Resmi Nair, An Atheist &amp; Leading Left voice who got arrested for running #SexRacket is being lined up by @CPIMKerala to enter #Sabarimala  Pic2 -An unknown Mother, a devotee of #Ayyappa, brutally beaten by #KeralaPolice while conducting a peaceful protest  End of Communism?  https://t.co/LUnorVUgVt",en,"[{'screen_name': 'cpimkerala', 'name': 'cpi(m) kerala', 'id': '2374863733'}]",[],"['https://pbs.twimg.com/media/Dpw_7UKXUAA_R3j.jpg', 'https://pbs.twimg.com/media/DpxCtvPU8AAchiS.jpg']",18,330,264,"['sexracket', 'sabarimala', 'ayyappa', 'keralapolice']",[],https://twitter.com/nach1keta/status/1052791772001263616,False,,1,https://pbs.twimg.com/media/Dpw_7UKXUAA_R3j.jpg,,,,,,,[],,,,
1052791747669983232,1052791747669983232,2018-10-18 10:51:27 IST,2018-10-18,10:51:27,+0530,46608340,rkradhakrishn,RadhakrishnanRK,,#Periyar brought God within the reach of the oppressed classes with #VaikkomTempleEntry. He got away with it. #SreeNarayanaGuru got away with worshipping #EzhavaSivan. The difference between then and now? A political party named @BJP4India #Sabarimala,en,"[{'screen_name': 'bjp4india', 'name': 'bjp', 'id': '207809313'}]",[],[],27,107,316,"['periyar', 'vaikkomtempleentry', 'sreenarayanaguru', 'ezhavasivan', 'sabarimala']",[],https://twitter.com/RKRadhakrishn/status/1052791747669983232,False,,0,,,,,,,,[],,,,
1052782969289609216,1052782969289609216,2018-10-18 10:16:34 IST,2018-10-18,10:16:34,+0530,1611887712,kuvalayamala,🍿,,Shocking tales of police brutality in #Sabarimala. Heart wrenching scenes of goon in khaki thrashing devotees. So called MSM has blacked out all these. MSM’s days of fooling ppl r over. Pity the frogs in the well who think public won’t get to know the truth if they don’t show it.,en,[],[],[],33,786,630,['sabarimala'],[],https://twitter.com/Kuvalayamala/status/1052782969289609216,False,https://twitter.com/surnell/status/1052651760098127877,0,,,,,,,,[],,,,
1052774345641054210,1052774345641054210,2018-10-18 09:42:18 IST,2018-10-18,09:42:18,+0530,158295414,meenakshisharan,Meenakshi Sharan,,"Does #Sabarimala criminally/ Socially affect/ interfere with Indian Society’s Fabric, or daily life?  ..But the Burkha Clad does! Slaughtering Cows/ animals does! Howling on loudspeakers 5x365 does! #TripleTalaq does! Healing drama in the garb of #conversions does! @narendramodi",en,"[{'screen_name': 'narendramodi', 'name': 'narendra modi', 'id': '18839785'}]",[],[],19,252,292,"['sabarimala', 'tripletalaq', 'conversions']",[],https://twitter.com/meenakshisharan/status/1052774345641054210,False,https://twitter.com/meenakshisharan/status/1052573716301803520,0,,,,,,,,[],,,,
1052769968889053184,1052769968889053184,2018-10-18 09:24:54 IST,2018-10-18,09:24:54,+0530,87629490,divyasoti,Divya Kumar Soti,,Married men are not allowed to enter sanctum sanctorum of Brahma Temple at Pushkar. Off course it has nothing to do with gender discrimination. #Sabarimala,en,[],[],[],10,288,363,['sabarimala'],[],https://twitter.com/DivyaSoti/status/1052769968889053184,False,,0,,,,,,,,[],,,,
1052766133814681601,1052766133814681601,2018-10-18 09:09:40 IST,2018-10-18,09:09:40,+0530,105733665,sakshijoshii,Sakshi Joshi,,Oh my God. Look at this hooligan mob lynchers.... thank God for that man clad in saffron... atleast he seemed a little sympathetic towards her n closed her car’s door... before people attack her #Sabarimala,en,[],[],[],18,53,228,['sabarimala'],[],https://twitter.com/sakshijoshii/status/1052766133814681601,False,https://twitter.com/TheSamirAbbas/status/1052582358434623488,0,,,,,,,,[],,,,
1052745037572792320,1052745037572792320,2018-10-18 07:45:50 IST,2018-10-18,07:45:50,+0530,906105384854630400,ethirajans,Ethirajan Srinivasan 🇮🇳🚩,,"Pinarayi has clearly underestimated the conviction of HINDUS and miserably failed to assess the reality, which will cost him heavily for sure! Hope this #Sabarimala issue brings a good end to Communism in India.",en,[],[],[],27,185,402,['sabarimala'],[],https://twitter.com/Ethirajans/status/1052745037572792320,False,,0,,,,,,,,[],,,,
1052744270765940736,1052744270765940736,2018-10-18 07:42:47 IST,2018-10-18,07:42:47,+0530,3301180524,iamrajii,Raji Subramanian,,"If #BJP is trying to politicize #Sabarimala issue, I'm sorry, this will only backfire them. If you don't voice out for them when in need, you ain't their ""gaurdians""! Dharma will find it's own path.But respected @Swamy39 comment on this is definitely hurting! #SaveSabarimala",en,"[{'screen_name': 'swamy39', 'name': 'subramanian swamy', 'id': '60937837'}]",[],[],38,117,290,"['bjp', 'sabarimala', 'savesabarimala']",[],https://twitter.com/IamRajii/status/1052744270765940736,False,,0,,,,,,,,[],,,,
