id,conversation_id,created_at,date,time,timezone,user_id,username,name,place,tweet,language,mentions,urls,photos,replies_count,retweets_count,likes_count,hashtags,cashtags,link,retweet,quote_url,video,thumbnail,near,geo,source,user_rt_id,user_rt,retweet_id,reply_to,retweet_date,translate,trans_src,trans_dest
1080328299807674369,1080328299807674369,2019-01-02 10:31:52 IST,2019-01-02,10:31:52,+0530,1263706735,kavita_krishnan,Kavita Krishnan,,"Modi to Muslims on #Sabarimala and #TripleTalaqBill - Hamara patriarchy - tradition, tumhara tradition - patriarchy. Mera illegal desertion - desh seva, tumhara illegal desertion, jurm jiske liye jail hoga.",hi,[],[],[],43,123,306,"['sabarimala', 'tripletalaqbill']",[],https://twitter.com/kavita_krishnan/status/1080328299807674369,False,,0,,,,,,,,[],,,,
1080327513153380352,1080327513153380352,2019-01-02 10:28:45 IST,2019-01-02,10:28:45,+0530,1263706735,kavita_krishnan,Kavita Krishnan,,"The thantri of #Sabarimala has just said on tv that they'll close the temple and hold a purification ceremony to cleanse it of the polluting effect of the entry of two women. What will SC do in the face of this defiance of its order, this untouchability? +",en,[],[],[],145,265,687,['sabarimala'],[],https://twitter.com/kavita_krishnan/status/1080327513153380352,False,,0,,,,,,,,[],,,,
1080325947323236352,1080325947323236352,2019-01-02 10:22:31 IST,2019-01-02,10:22:31,+0530,24338525,thedeshbhakt,The DeshBhakt,,Notice how the REAL devotees have no issues with women present at #Sabarimala. The only ones having issues are those who use the name of God for personal fame and profit.,en,[],[],[],82,432,1512,['sabarimala'],[],https://twitter.com/TheDeshBhakt/status/1080325947323236352,False,https://twitter.com/arvindgunasekar/status/1080310310416789504,0,,,,,,,,[],,,,
1080325280944680960,1080325280944680960,2019-01-02 10:19:53 IST,2019-01-02,10:19:53,+0530,4498208480,krithikasivasw,krithika sivaswamy,,"Vote a communist,  Anti Hindu government to power. What do you expect?  Funds to encourage Kerala School of mathematics and research on Madhavacharya's works?  Will we ever connect the dots?  #Sabarimala #SabarimalaTemple",en,[],[],[],10,158,308,"['sabarimala', 'sabarimalatemple']",[],https://twitter.com/krithikasivasw/status/1080325280944680960,False,,0,,,,,,,,[],,,,
1080323641143844864,1080323641143844864,2019-01-02 10:13:22 IST,2019-01-02,10:13:22,+0530,1934388686,shefvaidya,Shefali Vaidya. 🇮🇳,,There is something fishy about that furtive video of the two burkha clad women seen entering a temple that is supposed to be #sabarimala. I would wait for a bit before starting the collective wailing.,en,[],[],[],117,244,778,['sabarimala'],[],https://twitter.com/ShefVaidya/status/1080323641143844864,False,,0,,,,,,,,[],,,,
1080323315795816448,1080323315795816448,2019-01-02 10:12:04 IST,2019-01-02,10:12:04,+0530,46427326,suryahsg,SG Suryah,,What a sad day! Perpetrators will not be spared by the almighty. #Sabarimala ! Shame!,en,[],[],[],41,178,532,['sabarimala'],[],https://twitter.com/SuryahSG/status/1080323315795816448,False,,0,,,,,,,,[],,,,
1080322760524480512,1080322760524480512,2019-01-02 10:09:52 IST,2019-01-02,10:09:52,+0530,77490131,advaidism,Advaid അദ്വൈത്,,"In the last 24 hours, CPM and the LEFT has broken the very backbone of BJP and Savarna fascists in Kerala without shedding a drop of blood.  #Womenwall and #Sabarimala women entry will be remembered as one of the biggest revolution ever in the pages of history.",en,[],[],[],14,163,392,"['womenwall', 'sabarimala']",[],https://twitter.com/Advaidism/status/1080322760524480512,False,,0,,,,,,,,[],,,,
1080321728264335361,1080321728264335361,2019-01-02 10:05:46 IST,2019-01-02,10:05:46,+0530,57207846,rahuleaswar,Rahul Easwar,,We condemn the Kerala CPM Govt and police conspiracy to secretly get in 2 young women into #Sabarimala by 3 am in morning  Such cheap tactics are unbecoming of a State Govt.,en,[],[],[],281,642,1531,['sabarimala'],[],https://twitter.com/RahulEaswar/status/1080321728264335361,False,,0,,,,,,,,[],,,,
1080320527871459329,1080320527871459329,2019-01-02 10:00:59 IST,2019-01-02,10:00:59,+0530,28114735,vijaita,Vijaita Singh,,"These are rules made by men, not surprised you are supporting this.  #antiwomen mindset #Sabarimala",en,[],[],[],29,83,263,"['antiwomen', 'sabarimala']",[],https://twitter.com/vijaita/status/1080320527871459329,False,https://twitter.com/PMOIndia/status/1080092075511578624,0,,,,,,,,[],,,,
1080319986332250113,1080319986332250113,2019-01-02 09:58:50 IST,2019-01-02,09:58:50,+0530,205694126,rose_k01,Rosy,,Two women Bindu and Kanakdurga entered Kerala's #Sabarimala Temple at 3.45am today. Both had attempted to trek Sabarimala few days back.  This is Commie Govt's true face &amp; their obssession of Breaking Sabarimala and Hindu Traditions by hook or by crook  https://t.co/9YWwS8KY7Z,en,[],[],['https://pbs.twimg.com/media/Dv4RSr4XgAE6HSQ.jpg'],44,201,318,['sabarimala'],[],https://twitter.com/rose_k01/status/1080319986332250113,False,,1,https://pbs.twimg.com/media/Dv4RSr4XgAE6HSQ.jpg,,,,,,,[],,,,
1080319596731674624,1080319596731674624,2019-01-02 09:57:17 IST,2019-01-02,09:57:17,+0530,77490131,advaidism,Advaid അദ്വൈത്,,"""The devotees had no issues when we entered Sabarimala. Kerala Police gave us protection.""  - Kanaga Durga speaking to Asianet News.  Bindu and Kanaga Durga entered #Sabarimala temple with Kerala Police security at 3.45 am today. There we no protests. History was made.  https://t.co/ipTzmBZ98K",en,[],[],['https://pbs.twimg.com/media/Dv4QhvYUcAE4To2.jpg'],8,73,135,['sabarimala'],[],https://twitter.com/Advaidism/status/1080319596731674624,False,,1,https://pbs.twimg.com/media/Dv4QhvYUcAE4To2.jpg,,,,,,,[],,,,
1080318343704428544,1080318343704428544,2019-01-02 09:52:19 IST,2019-01-02,09:52:19,+0530,283632721,smitabarooah,Smita Barooah,,Communists are Godless. Muslims reject idol worship &amp; Hindu traditions. So why are they obsessed with #Sabarimala &amp; the temple traditions? Whose interest does the desecration serve? This is not a fight for gender equality. It’s bigotry,en,[],[],[],85,1394,2434,['sabarimala'],[],https://twitter.com/smitabarooah/status/1080318343704428544,False,,0,,,,,,,,[],,,,
1080317169672478720,1080317169672478720,2019-01-02 09:47:39 IST,2019-01-02,09:47:39,+0530,4015086132,lotophagus,Padma Pillai,,"Two women, Bindu &amp; Kanaka durga have darshan at #Sabarimala, covered and shrouded, with escort from Mufti police.  Pinarayi vijayan has fulfilled the promise he made to his cadre.",en,[],[],[],234,771,1274,['sabarimala'],[],https://twitter.com/lotophagus/status/1080317169672478720,False,,0,,,,,,,,[],,,,
1080316807586574336,1080316807586574336,2019-01-02 09:46:12 IST,2019-01-02,09:46:12,+0530,77490131,advaidism,Advaid അദ്വൈത്,,ഇന്ന് ആത്മഹത്യ ചെയ്യാൻ പോവുന്നവർ മറ്റൊരു ദിവസത്തിലേക്ക് മാറ്റി വയ്ക്കുക.  ആത്‍മഹത്യ എന്തിന്റെ പേരിലായാലും ഒരു കൂട്ടർ കുമ്മനടിക്കും.  'issued in public interest' 😏 #Sabarimala,ml,[],[],[],5,31,177,['sabarimala'],[],https://twitter.com/Advaidism/status/1080316807586574336,False,,0,,,,,,,,[],,,,
1080315500914040834,1080315500914040834,2019-01-02 09:41:01 IST,2019-01-02,09:41:01,+0530,1422391526,swamigeetika,Geetika Swami,,#WednesdayWisdom Two women Bindu and Kanaka Durga managed Ayyappa Darshan at 3.45 am with the help of the Kerala police and govt at Sabarimala.There is no words to describe how Hindus feel cheated and violated today! #Sabarimala #SabarimalaTemple   https://t.co/6egoa0fs28,en,[],[],[],74,362,396,"['wednesdaywisdom', 'sabarimala', 'sabarimalatemple']",[],https://twitter.com/SwamiGeetika/status/1080315500914040834,False,,1,https://pbs.twimg.com/ext_tw_video_thumb/1080310152815734785/pu/img/iu6hFqa09mHRtLUq.jpg,,,,,,,[],,,,
1080312199359356928,1080312199359356928,2019-01-02 09:27:54 IST,2019-01-02,09:27:54,+0530,85330272,jaypanicker,Jayashankar,,Durga and Bindu enter #Sabarimala is what they claim...Who is the one who takes video...this means it was planned by Police....Unfortunate ...shocked,en,[],[],[],21,168,304,['sabarimala'],[],https://twitter.com/jaypanicker/status/1080312199359356928,False,,0,,,,,,,,[],,,,
1080312072372576256,1080312072372576256,2019-01-02 09:27:23 IST,2019-01-02,09:27:23,+0530,141439024,hariindic,Hari Prabhakaran #Cheer4India,,"Helped by cops, 2 women below 50's enters #Sabarimala and offered prayers through back gate without climbing 18 steps.  If it's true, temple should be shut and let devotees realise that SC/CPIM/State/Centre are all against them.  Swamiye Saranam Ayyappa 🙏 #SabarimalaTemple",en,[],[],[],20,77,282,"['sabarimala', 'sabarimalatemple']",[],https://twitter.com/Hariindic/status/1080312072372576256,False,,0,,,,,,,,[],,,,
1080310567359922177,1080310567359922177,2019-01-02 09:21:25 IST,2019-01-02,09:21:25,+0530,315421768,rifatjawaid,Rifat Jawaid,,Well done Bindu and Kanakdurga for creating history at #Sabarimala @JantaKaReporter  https://t.co/ga6G8ul8Qw,en,"[{'screen_name': 'jantakareporter', 'name': 'janta ka reporter', 'id': '3006989562'}]",['http://www.jantakareporter.com/india/two-women-finally-enter-and-pray-at-sabarimala-temple-first-after-supreme-court-order/225526/'],[],74,55,182,['sabarimala'],[],https://twitter.com/RifatJawaid/status/1080310567359922177,False,,0,,,,,,,,[],,,,
1080306477640822784,1080306477640822784,2019-01-02 09:05:10 IST,2019-01-02,09:05:10,+0530,219923571,snehamkoshy,Sneha Koshy,,"BIG BREAKING - Police sources to @ndtv - Two women below their 50s enter #Sabarimala temple for Darshan and have now left the area after darshan. They started their uphill climb by 12:30am and entered Sabarimala temple for darshan by 3:45am , according to police sources.",en,"[{'screen_name': 'ndtv', 'name': 'ndtv', 'id': '37034483'}]",[],[],11,112,295,['sabarimala'],[],https://twitter.com/SnehaMKoshy/status/1080306477640822784,False,,0,,,,,,,,[],,,,
1080290613356986368,1080290613356986368,2019-01-02 08:02:07 IST,2019-01-02,08:02:07,+0530,91025370,profpavarghese,Prof. P.A.Varghese,,#Sabarimala--entry of young women-is a question of tradition&amp;old practices.Muslim women r not let in mosques. Why double standards?Justice #InduMalhothra mentioned: SC shouldn't interfere in emotional-religious issues. Sabarimala's constitutional rights.Traditions r2b respected.,en,[],[],[],25,340,629,"['sabarimala', 'indumalhothra']",[],https://twitter.com/profpaVarghese/status/1080290613356986368,False,,0,,,,,,,,[],,,,
1080152619115376640,1080152619115376640,2019-01-01 22:53:47 IST,2019-01-01,22:53:47,+0530,131791334,vikassaraswat,Vikas Saraswat,,"So @cpimspeak makes it clear, its brutal oppression of #Sabarimala devotees is to please Muslims and Christians. Also shameful that Christains and Muslims are lending weight to such an exercise. This is now an open war by Marx Mullah Missionary combine on Hindus",en,"[{'screen_name': 'cpimspeak', 'name': 'cpi (m)', 'id': '2341741537'}]",[],[],15,257,338,['sabarimala'],[],https://twitter.com/VikasSaraswat/status/1080152619115376640,False,https://twitter.com/cpimspeak/status/1080052573363527680,0,,,,,,,,[],,,,
1080127302502137864,1080127302502137864,2019-01-01 21:13:11 IST,2019-01-01,21:13:11,+0530,31656892,kapilmishra_ind,Kapil Mishra,,"इन बुर्क़ानशीं महिलायों की मांग हैं कि #Sabrimala में महिलायों को #LordAyyappa के दर्शन और पूजा की इजाज़त मिलनी चाहिए  या ख़ुदा ख़ैर - तेरे से भरोसा उठ गया इन नाचीज़ो का, अब इन्हें मस्ज़िद नहीं #Sabarimala जाना हैं  https://t.co/Vl5zSS2BXs",hi,[],[],"['https://pbs.twimg.com/media/Dv1iDSGXgAEh2UX.jpg', 'https://pbs.twimg.com/media/Dv1iDiDXgAAmFMP.jpg']",603,4659,10350,"['sabrimala', 'lordayyappa', 'sabarimala']",[],https://twitter.com/KapilMishra_IND/status/1080127302502137864,False,,1,https://pbs.twimg.com/media/Dv1iDSGXgAEh2UX.jpg,,,,,,,[],,,,
1080126540812234752,1080126540812234752,2019-01-01 21:10:09 IST,2019-01-01,21:10:09,+0530,4015086132,lotophagus,Padma Pillai,,"Swami Sharanam!! I was on the verge of losing hope!!   Thank you @narendramodi  ji, from the depths of my heart. With this simple statement, you have lit hope in us.  #ReadyToWait #Sabarimala",en,"[{'screen_name': 'narendramodi', 'name': 'narendra modi', 'id': '18839785'}]",[],[],76,1015,2852,"['readytowait', 'sabarimala']",[],https://twitter.com/lotophagus/status/1080126540812234752,False,https://twitter.com/PMOIndia/status/1080092075511578624,0,,,,,,,,[],,,,
1080108361427763201,1080092075511578624,2019-01-01 19:57:55 IST,2019-01-01,19:57:55,+0530,1249627604,anuraag_saxena,Anuraag Saxena,,@PMOIndia @narendramodi 3 things @narendramodi ji shd do in solidarity to #Sabarimala: A. Wear black mundu. B. Say #SwamiyeSaranamAyyappa. C. Announce this ordinance.   https://t.co/zmksevQKrN,en,"[{'screen_name': 'narendramodi', 'name': 'narendra modi', 'id': '18839785'}]",['https://www.sundayguardianlive.com/opinion/needed-religious-freedom-restoration-ordinance'],[],18,119,356,"['sabarimala', 'swamiyesaranamayyappa']",[],https://twitter.com/anuraag_saxena/status/1080108361427763201,False,,0,,,,,,,,"[{'screen_name': 'PMOIndia', 'name': 'PMO India', 'id': '471741741'}, {'screen_name': 'narendramodi', 'name': 'Narendra Modi', 'id': '18839785'}]",,,,
1080090391313973248,1080090391313973248,2019-01-01 18:46:31 IST,2019-01-01,18:46:31,+0530,247218601,sudeepsudhakrn,Sudeep Sudhakaran,,"If you want to defeat Sangh Parivar from this country, learn from this man. #WomensWall #VanithaMathil #Sabarimala  https://t.co/Y7OhwfPgBU",en,[],[],['https://pbs.twimg.com/media/Dv1AewqVYAAYgj0.jpg'],6,79,274,"['womenswall', 'vanithamathil', 'sabarimala']",[],https://twitter.com/SudeepSudhakrn/status/1080090391313973248,False,,1,https://pbs.twimg.com/media/Dv1AewqVYAAYgj0.jpg,,,,,,,[],,,,
1080090068004622336,1080090068004622336,2019-01-01 18:45:13 IST,2019-01-01,18:45:13,+0530,39234827,jsaideepak,Sai Deepak J,,"Thank you for speaking on this Shri @narendramodi ji! Just to add to your point Sir, it is not merely a tradition,it is a core religious practice which is integral to the #Sabarimala Ayyappa Temple. So it's centrality to d identity of the Temple is more than that of a tradition.",en,"[{'screen_name': 'narendramodi', 'name': 'narendra modi', 'id': '18839785'}]",[],[],56,897,2064,['sabarimala'],[],https://twitter.com/jsaideepak/status/1080090068004622336,False,https://twitter.com/ani_digital/status/1080083805724180481,0,,,,,,,,[],,,,
1080082918523908101,1080082918523908101,2019-01-01 18:16:49 IST,2019-01-01,18:16:49,+0530,4015086132,lotophagus,Padma Pillai,,"A Woman-wall challenging traditions at #Sabarimala, was engineered by CPIM govt today to counter the lakhs of hindu women who protested the verdict.  The wall was useful. It fully exposed the panic &amp; hate, craftily hidden by certain people till now.  https://t.co/nP7U51tQgY",en,[],[],"['https://pbs.twimg.com/media/Dv04R0KVAAEDfGF.jpg', 'https://pbs.twimg.com/media/Dv04R0KVAAM3FS5.jpg', 'https://pbs.twimg.com/media/Dv04U7cUUAAil1P.jpg']",526,2665,4077,['sabarimala'],[],https://twitter.com/lotophagus/status/1080082918523908101,False,,1,https://pbs.twimg.com/media/Dv04R0KVAAEDfGF.jpg,,,,,,,[],,,,
1080080240875995136,1080080240875995136,2019-01-01 18:06:11 IST,2019-01-01,18:06:11,+0530,906105384854630400,ethirajans,Ethirajan Srinivasan 🇮🇳🚩,,Irony died of suffocation when these Burqa clad women demanded equal rights for women in #Sabarimala!  https://t.co/qgjUcFRbY0,en,[],[],['https://pbs.twimg.com/media/Dv03OY1UcAEo-Do.jpg'],175,1463,2493,['sabarimala'],[],https://twitter.com/Ethirajans/status/1080080240875995136,False,,1,https://pbs.twimg.com/media/Dv03OY1UcAEo-Do.jpg,,,,,,,[],,,,
1080033734370316289,1080033734370316289,2019-01-01 15:01:22 IST,2019-01-01,15:01:22,+0530,241842989,aju000,Arjun Ramakrishnan ☭,,"The rightful keepers of the #Sabarimala temple, Malayarayas, getting ready to travel and join #VanithaMathil. It's from them that the erstwhile royal family and thanthri family snatched the rights for the temple, and they will take it back.  #WomensWall  #OurRenaissance  https://t.co/5mNj5VCh7y",en,[],[],['https://pbs.twimg.com/media/Dv0M8nmUUAACkTl.jpg'],11,89,213,"['sabarimala', 'vanithamathil', 'womenswall', 'ourrenaissance']",[],https://twitter.com/aju000/status/1080033734370316289,False,,1,https://pbs.twimg.com/media/Dv0M8nmUUAACkTl.jpg,,,,,,,[],,,,
1079929382263648261,1079929382263648261,2019-01-01 08:06:43 IST,2019-01-01,08:06:43,+0530,906105384854630400,ethirajans,Ethirajan Srinivasan 🇮🇳🚩,,"Hate, absolute Hate!  DMK's tirade against HINDUS continues!  Practice of carrying IRUMUDI to #Sabarimala was started when there was a famine in Kerala, during which trucks were not allowed to transport rice, so Ayyappa devotees smuggled rice into Kerala using Irumudis.  https://t.co/kcbWXKuWo8",en,[],[],[],29,152,161,['sabarimala'],[],https://twitter.com/Ethirajans/status/1079929382263648261,False,,1,https://pbs.twimg.com/ext_tw_video_thumb/1079929061458075655/pu/img/A9n3SihAWbs-nv8F.jpg,,,,,,,[],,,,
1079761748566003713,1079761748566003713,2018-12-31 21:00:36 IST,2018-12-31,21:00:36,+0530,1136045718,im_saiganesh,Saiganesh சாய்கணேஷ்,,"Suba Veerapandian, the man who represents DMK in TV channels say that the practice of carrying Irumudi to #Sabarimala was started to smuggle rice from TN to Kerala. Shame that no action is taken by @mkstalin on him, as huge number of Ayyappa devotees are present in Tamil Nadu.  https://t.co/U4LKB8t0al",en,"[{'screen_name': 'mkstalin', 'name': 'm.k.stalin', 'id': '2163039523'}]",[],[],131,457,499,['sabarimala'],[],https://twitter.com/im_saiganesh/status/1079761748566003713,False,,1,https://pbs.twimg.com/ext_tw_video_thumb/1079761537961607169/pu/img/XUA7xvZN7FdTUQNd.jpg,,,,,,,[],,,,
1079724434515058688,1079724434515058688,2018-12-31 18:32:20 IST,2018-12-31,18:32:20,+0530,272801887,pratheesh_hind,Pratheesh Viswanath,,Police moved to court to cancel my bail. U can do whatevr u want. 1000s of devotees r here pledging themselves to shield Temple. Even in my absence they wil do it and Aurangzeb's aim to destroy #Sabarimala is nvr going to win. I m only one humble devotee among them. Swamy Saranam  https://t.co/Eh2eSA9TPW,en,[],[],['https://pbs.twimg.com/media/DvvzmmmUYAIR8S_.jpg'],19,406,849,['sabarimala'],[],https://twitter.com/pratheesh_Hind/status/1079724434515058688,False,,1,https://pbs.twimg.com/media/DvvzmmmUYAIR8S_.jpg,,,,,,,[],,,,
1079663849316335617,1079663849316335617,2018-12-31 14:31:35 IST,2018-12-31,14:31:35,+0530,867004927138119680,excomradekerala,Ex-Comrade ☭,,CPM gets Church's support for ‘Caste Wall’ to divide Hindu society: 1 lakh Jacobite Christians to join CPM Government’s ‘Women’s Wall’ against #Sabarimala:  https://t.co/cHajqz6lNO,en,[],['http://www.organiser.org//Encyc/2018/12/31/CPM-gets-Church-s-support-for-Caste-Wall.html'],[],24,240,199,['sabarimala'],[],https://twitter.com/excomradekerala/status/1079663849316335617,False,,0,,,,,,,,[],,,,
1079626811087015936,1079626811087015936,2018-12-31 12:04:24 IST,2018-12-31,12:04:24,+0530,272801887,pratheesh_hind,Pratheesh Viswanath,,Reached Pamba in morning. Stopped two more activists from entering the shrine. #UrbanNaxals r sending one or other routinely. Till my heart beats We wont allow them to break our culture and traditions. Swamy Saranam. #Sabarimala  https://t.co/4rB8rkSkHy,en,[],[],['https://pbs.twimg.com/media/Dvua2vyUcAEL9v5.jpg'],10,86,228,"['urbannaxals', 'sabarimala']",[],https://twitter.com/pratheesh_Hind/status/1079626811087015936,False,,1,https://pbs.twimg.com/media/Dvua2vyUcAEL9v5.jpg,,,,,,,[],,,,
1079289439292018688,1079289439292018688,2018-12-30 13:43:49 IST,2018-12-30,13:43:49,+0530,272801887,pratheesh_hind,Pratheesh Viswanath,,#UrbanNaxals wil bring more feminists. #Sabarimala reopens today. Crucial 21days b4 us. Devotees frm othr states helpd a lot these days. V Need more. If u get any info of feminists coming frm ur states pls call 9400161516. Also call if u wish to join us at Sannidanam. Max RT pls  https://t.co/roDwJdvh30,en,[],[],['https://pbs.twimg.com/media/DvpoApIU0AASYeW.jpg'],44,1184,1684,"['urbannaxals', 'sabarimala']",[],https://twitter.com/pratheesh_Hind/status/1079289439292018688,False,,1,https://pbs.twimg.com/media/DvpoApIU0AASYeW.jpg,,,,,,,[],,,,
1079243315755663360,1079243315755663360,2018-12-30 10:40:32 IST,2018-12-30,10:40:32,+0530,1934388686,shefvaidya,Shefali Vaidya. 🇮🇳,,"The one thing @narendramodi should do is to address a public rally in Kerala wearing black mundu and kurta with vibhooti on his forehead, to show his solidarity with #Sabarimala pilgrims.",en,"[{'screen_name': 'narendramodi', 'name': 'narendra modi', 'id': '18839785'}]",[],[],189,1385,4429,['sabarimala'],[],https://twitter.com/ShefVaidya/status/1079243315755663360,False,,0,,,,,,,,[],,,,
1078996633616957441,1078996633616957441,2018-12-29 18:20:18 IST,2018-12-29,18:20:18,+0530,24705126,shashitharoor,Shashi Tharoor,,The @MahilaCongress members in Kerala are for the most part believers who respect the sanctity of LordAyyappa’s shrine in #Sabarimala. They resent the misuse of this sacred spot as a stage for political theatre by BJP &amp; CPM. Here @MullappallyR &amp; @INCKerala leaders stand by them.  https://t.co/q4YZpxZcOe,en,"[{'screen_name': 'mahilacongress', 'name': 'all india mahila congress', 'id': '4446761654'}, {'screen_name': 'mullappallyr', 'name': 'mullappally ramachandran', 'id': '928252325952610304'}, {'screen_name': 'inckerala', 'name': 'congress kerala', 'id': '2333150096'}]",[],"['https://pbs.twimg.com/media/DvldtZ6VsAcrTQl.jpg', 'https://pbs.twimg.com/media/DvldtZ7UwAAniHI.jpg', 'https://pbs.twimg.com/media/DvldtZ6UwAE--nt.jpg']",14,54,243,['sabarimala'],[],https://twitter.com/ShashiTharoor/status/1078996633616957441,False,,1,https://pbs.twimg.com/media/DvldtZ6VsAcrTQl.jpg,,,,,,,[],,,,
1078849099066044416,1078849099066044416,2018-12-29 08:34:03 IST,2018-12-29,08:34:03,+0530,272801887,pratheesh_hind,Pratheesh Viswanath,,Foreighners taking part in #AyyappaJyothi. They removed footwears b4 lighting lamp and shown respect. The #UrbanNaxals should atleast learn from them abt how to respect the great Hindu culture and its traditions. Swamy Saranam. #Sabarimala  https://t.co/SK0CsL7zVK,en,[],[],['https://pbs.twimg.com/media/DvjXhujU0AQB--s.jpg'],4,152,363,"['ayyappajyothi', 'urbannaxals', 'sabarimala']",[],https://twitter.com/pratheesh_Hind/status/1078849099066044416,False,,1,https://pbs.twimg.com/media/DvjXhujU0AQB--s.jpg,,,,,,,[],,,,
1078701084888174592,1078701084888174592,2018-12-28 22:45:54 IST,2018-12-28,22:45:54,+0530,205694126,rose_k01,Rosy,,Harivarasanam at #Sabarimala as the Thirunada closes #SaveSabarimalaTradition  https://t.co/orBEz9g3kd,en,[],[],[],12,68,183,"['sabarimala', 'savesabarimalatradition']",[],https://twitter.com/rose_k01/status/1078701084888174592,False,,1,https://pbs.twimg.com/ext_tw_video_thumb/1078700937546526720/pu/img/SVL_-SRNk4W3RW7Z.jpg,,,,,,,[],,,,
1078562117651914753,1078562117651914753,2018-12-28 13:33:42 IST,2018-12-28,13:33:42,+0530,2842654885,nitinshanbhag,Nitin Shanbhag,,"You will hardly find such a neat explanation on #TripleTalaqBill , #Sabarimala and @narendramodi ji’s successful schemes on #WomenEmpowerment @M_Lekhi ji’s crisp, clear and factual talk showcases her leadership and @PMOIndia ‘s good governance. Do watch!  https://t.co/zEZBlaWTQt",en,"[{'screen_name': 'narendramodi', 'name': 'narendra modi', 'id': '18839785'}, {'screen_name': 'm_lekhi', 'name': 'meenakashi lekhi', 'id': '373410448'}, {'screen_name': 'pmoindia', 'name': 'pmo india', 'id': '471741741'}]",[],[],5,179,338,"['tripletalaqbill', 'sabarimala', 'womenempowerment']",[],https://twitter.com/NitinShanbhag/status/1078562117651914753,False,,1,https://pbs.twimg.com/ext_tw_video_thumb/1078562061481734146/pu/img/nOMIhx2xiOW3WJHr.jpg,,,,,,,[],,,,
1078560284237881344,1078560284237881344,2018-12-28 13:26:25 IST,2018-12-28,13:26:25,+0530,2154253520,sbajpai2806,Shishir Bajpai 🇮🇳,,2.5 Million #Ayyappa Devotees Line up with Lamps: ‘Ayyappa Jyothi’ Creates an Unprecedented Expression of #Hindu Unity in Kerala:  https://t.co/uKY4ehXOMp #Sabarimala @sgurumurthy,en,"[{'screen_name': 'sgurumurthy', 'name': 's gurumurthy', 'id': '129057534'}]",['http://www.organiser.org//Encyc/2018/12/27/Ayyappa-Jyothi.html'],[],17,312,648,"['ayyappa', 'hindu', 'sabarimala']",[],https://twitter.com/sbajpai2806/status/1078560284237881344,False,,0,,,,,,,,[],,,,
1078481327962247169,1078481327962247169,2018-12-28 08:12:40 IST,2018-12-28,08:12:40,+0530,21080743,ratansharda55,Ratan Sharda 🇮🇳,,People are creating false equivalence between #TripleTalaq and #Sabarimala  Sabarimala is a matter of choice within plural tradition. T3 is a matter of oppression of woman by husband with NO choice .,en,[],[],[],11,251,527,"['tripletalaq', 'sabarimala']",[],https://twitter.com/RatanSharda55/status/1078481327962247169,False,,0,,,,,,,,[],,,,
1078380989808689152,1078380989808689152,2018-12-28 01:33:57 IST,2018-12-28,01:33:57,+0530,85330272,jaypanicker,Jayashankar,,Mrs @M_Lekhi 's powerful pitch for protection of traditions at #Sabarimala in Loksabha today.Well atriculated  https://t.co/sgSmkZxbXH,en,"[{'screen_name': 'm_lekhi', 'name': 'meenakashi lekhi', 'id': '373410448'}]",[],[],6,180,327,['sabarimala'],[],https://twitter.com/jaypanicker/status/1078380989808689152,False,,1,https://pbs.twimg.com/ext_tw_video_thumb/1078380879200710656/pu/img/Y-LKm-pFjNUu5pCp.jpg,,,,,,,[],,,,
