id,conversation_id,created_at,date,time,timezone,user_id,username,name,place,tweet,language,mentions,urls,photos,replies_count,retweets_count,likes_count,hashtags,cashtags,link,retweet,quote_url,video,thumbnail,near,geo,source,user_rt_id,user_rt,retweet_id,reply_to,retweet_date,translate,trans_src,trans_dest
1059854696339275776,1059854696339275776,2018-11-06 22:37:05 IST,2018-11-06,22:37:05,+0530,2175523945,subytweets,Suby #ReleaseSanjivBhatt,,"If closing the door to a place of worship &amp; denying genuine believers, is victory to you, then you're a sore loser Rahul. A woman was attacked for looking younger than 50 with cries to ""Kill her"". What kind of a victory is that u coward, hiding behind BJP cloak? #Sabarimala",en,[],[],[],9,135,297,['sabarimala'],[],https://twitter.com/Subytweets/status/1059854696339275776,False,https://twitter.com/RahulEaswar/status/1059849602197741568,0,,,,,,,,[],,,,
1059854221330198528,1059854221330198528,2018-11-06 22:35:12 IST,2018-11-06,22:35:12,+0530,57207846,rahuleaswar,Rahul Easwar,,"Lets think abt Ordinance for our #Hindu Temples of #Ayodhya &amp; #Sabarimala  Ordinance which Protects Places of Worship &amp; that is Faith Friendly.   Lets take into consideration all sensitivities too.   ORDINANCE for - Sri Ram &amp; Swamy Ayyappa   Jai Sri Ram, Swamiyee Saranam Ayyappa  https://t.co/kQP1QLTW81",en,[],[],"['https://pbs.twimg.com/media/DrVbM7uU4AAjYHq.jpg', 'https://pbs.twimg.com/media/DrVbNxJVYAAyRFz.jpg']",20,97,223,"['hindu', 'ayodhya', 'sabarimala']",[],https://twitter.com/RahulEaswar/status/1059854221330198528,False,,1,https://pbs.twimg.com/media/DrVbM7uU4AAjYHq.jpg,,,,,,,[],,,,
1059849826844631040,1059849826844631040,2018-11-06 22:17:44 IST,2018-11-06,22:17:44,+0530,272801887,pratheesh_hind,Pratheesh Viswanath,,"Yudh samaapth. V won the battle. Temple closed. Ayyappa Swamy went back to Yoga nidra listening Harivarasanam. V bare footedly resisted 2500 police men, tear gases, granedes &amp;threats. Aurangzeb lost b4 Ayyappa Swamy. Nw Our last batch leaving Sannidanam. SwamySaranam. #Sabarimala  https://t.co/XtIchLgcQN",en,[],[],['https://pbs.twimg.com/media/DrVXx5fUwAE70mR.jpg'],158,964,2192,['sabarimala'],[],https://twitter.com/pratheesh_Hind/status/1059849826844631040,False,,1,https://pbs.twimg.com/media/DrVXx5fUwAE70mR.jpg,,,,,,,[],,,,
1059849602197741568,1059849602197741568,2018-11-06 22:16:50 IST,2018-11-06,22:16:50,+0530,57207846,rahuleaswar,Rahul Easwar,,Great Victory again  #Sabarimala Temple closes --  Sabarimala still not breached by Feminazis &amp; Atheist Forces. Swamiyeee Saranam Ayyappa  https://t.co/XVl5IhEA3b,en,[],[],['https://pbs.twimg.com/media/DrVXlAxU0AECPWS.jpg'],66,101,333,['sabarimala'],[],https://twitter.com/RahulEaswar/status/1059849602197741568,False,,1,https://pbs.twimg.com/media/DrVXlAxU0AECPWS.jpg,,,,,,,[],,,,
1059824620071727106,1059824620071727106,2018-11-06 20:37:34 IST,2018-11-06,20:37:34,+0530,4446761654,mahilacongress,All India Mahila Congress,,"Now that there is video of Kerala BJP chief Sreedharan boasting about “setting the agenda” for #Sabarimala protests,claims made by BJP of merely supporting a “spontaneous movement” by devotees, has been busted.Time for Kerala govt to punish the culprits   https://t.co/c4PxWoaGRt",en,[],['https://www.telegraphindia.com/india/on-secret-camera-bjp-boast-on-sabarimala/cid/1674143'],[],3,81,176,['sabarimala'],[],https://twitter.com/MahilaCongress/status/1059824620071727106,False,,0,,,,,,,,[],,,,
1059790038521638912,1059790038521638912,2018-11-06 18:20:09 IST,2018-11-06,18:20:09,+0530,272801887,pratheesh_hind,Pratheesh Viswanath,,Kerala Aurangzeb shut down all food sources to defeat us. He thought we will leave when v starve. He doesnt kno Ayyappa Swamy is leading us. When all other sources closed Ayyappa Swamy's Nivedyam rice came in search of us. Swamy Saranam. #Sabarimala  https://t.co/yv5hHsMVxm,en,[],[],['https://pbs.twimg.com/media/DrUhaVpVsAE3vn9.jpg'],32,845,1604,['sabarimala'],[],https://twitter.com/pratheesh_Hind/status/1059790038521638912,False,,1,https://pbs.twimg.com/media/DrUhaVpVsAE3vn9.jpg,,,,,,,[],,,,
1059780448254091264,1059780448254091264,2018-11-06 17:42:03 IST,2018-11-06,17:42:03,+0530,4446761654,mahilacongress,All India Mahila Congress,,.@BJP4India President @AmitShah's woes continue as his controversial &amp; unconstitutional speech against the #Sabarimala verdict hs come under severe criticism from Retired IAS &amp; IFS officers. It is a Shame tht an MP cn insult the Supreme Court so blatantly.  https://t.co/9gGP7lyIcj,en,"[{'screen_name': 'bjp4india', 'name': 'bjp', 'id': '207809313'}, {'screen_name': 'amitshah', 'name': 'amit shah', 'id': '1447949844'}]",['https://thewire.in/politics/amit-shah-sabarimala-speech-ias-ifs'],[],1,125,212,['sabarimala'],[],https://twitter.com/MahilaCongress/status/1059780448254091264,False,,0,,,,,,,,[],,,,
1059763204497334274,1059763204497334274,2018-11-06 16:33:32 IST,2018-11-06,16:33:32,+0530,2261350952,prafullaketkar,prafulla ketkar 🇮🇳,,"CPM Fascism in #Sabarimala : Devotees suffer as the Police Shut Down Toilets, Cut Power-Water Supply to Sannidhanam #SaveSabarimala ⁦@MRVChennai⁩ ⁦@sgurumurthy⁩   https://t.co/ZtELhseI6T",en,"[{'screen_name': 'mrvchennai', 'name': 'mrv', 'id': '351568421'}, {'screen_name': 'sgurumurthy', 'name': 's gurumurthy', 'id': '129057534'}]",['http://www.organiser.org//Encyc/2018/11/6/CPM-Fascism-in-Sabarimala.html'],[],16,239,198,"['sabarimala', 'savesabarimala']",[],https://twitter.com/prafullaketkar/status/1059763204497334274,False,,0,,,,,,,,[],,,,
1059762647338487809,1059762647338487809,2018-11-06 16:31:19 IST,2018-11-06,16:31:19,+0530,381891557,eorganiser,Organiser Weekly,,"CPM leader 'compelled' his wife to visit #Sabarimala against her wish, only to implement his party’s decision to ensure ‘gender equality’:  https://t.co/sP4AI5PrKZ",en,[],['http://www.organiser.org//Encyc/2018/11/6/CPM-leader-compelled-his-wife-to-visit-Sabarimala-against-her-wish-only-to-implement-his-party-s-decision-to-ensure-gender-equality-.html'],[],5,216,158,['sabarimala'],[],https://twitter.com/eOrganiser/status/1059762647338487809,False,,0,,,,,,,,[],,,,
1059719903677046785,1059719903677046785,2018-11-06 13:41:28 IST,2018-11-06,13:41:28,+0530,57207846,rahuleaswar,Rahul Easwar,,Let us #Sabarimala devotees be very clear on this.  We will STOP Trupti Desai from intruding into Sabarimala belief. And we will resist invasion by Atheists &amp; FemiNazis   The case is subjudice. She should not engage in provocation before November 13.    #SaveSabarimala,en,[],[],[],63,209,429,"['sabarimala', 'savesabarimala']",[],https://twitter.com/RahulEaswar/status/1059719903677046785,False,https://twitter.com/tvjanam/status/1059709703201026048,0,,,,,,,,[],,,,
1059708957898432512,1059708957898432512,2018-11-06 12:57:58 IST,2018-11-06,12:57:58,+0530,867004927138119680,excomradekerala,Ex-Comrade ☭,,#Sabarimala Sannidhanam is under our control! Over over.... : #ValsanThillankeri   @CMOKerala nee enna ninache “ @RSSorg enna summava”   “Supreme excellence consists of breaking the enemy's resistance without fighting” Sun Tzu. That’s what Sangh did in #Sabarimala #GoodByeCPM  https://t.co/hzDwt44Lse,en,"[{'screen_name': 'cmokerala', 'name': 'cmo kerala', 'id': '737583593245937664'}, {'screen_name': 'rssorg', 'name': 'rss', 'id': '310239584'}]",[],['https://pbs.twimg.com/media/DrTXqivU0AALZjK.jpg'],0,93,159,"['sabarimala', 'valsanthillankeri', 'sabarimala', 'goodbyecpm']",[],https://twitter.com/excomradekerala/status/1059708957898432512,False,,1,https://pbs.twimg.com/media/DrTXqivU0AALZjK.jpg,,,,,,,[],,,,
1059688040388411392,1059688040388411392,2018-11-06 11:34:51 IST,2018-11-06,11:34:51,+0530,1439046398,inquestioner,Sasidharan Pazhoor,,I feel ashamed to be a Malayali.   #Sabarimala  #SabarimalaShowdown,en,[],[],[],37,46,219,"['sabarimala', 'sabarimalashowdown']",[],https://twitter.com/inquestioner/status/1059688040388411392,False,,0,,,,,,,,[],,,,
1059684484990332928,1059684484990332928,2018-11-06 11:20:43 IST,2018-11-06,11:20:43,+0530,111311246,venuvakeel,Venugopal,,"Yes , Now I am relaxed #Sabarimala is under control of @RSSorg leader Valsan Thilankeri. And need not worry about any breach of tradition. Temple belongs to devotees and devotees know how to  handle it. Swamiye Sharanam  https://t.co/jGGlPkgvGr",en,"[{'screen_name': 'rssorg', 'name': 'rss', 'id': '310239584'}]",[],['https://pbs.twimg.com/media/DrTBO1zXQAAIHsI.jpg'],52,563,1234,['sabarimala'],[],https://twitter.com/venuvakeel/status/1059684484990332928,False,,1,https://pbs.twimg.com/media/DrTBO1zXQAAIHsI.jpg,,,,,,,[],,,,
1059682235287306240,1059667536948559872,2018-11-06 11:11:47 IST,2018-11-06,11:11:47,+0530,63020100,arunakrishnan,Aruna Krishnan അരുണ കൃഷ്ണൻ अरुणा कृष्णन 🇮🇳,,"#Sabarimala Showing on @TVJanam, small children Ayyappa bhaktas saying we came yesterday, no water to drink, ate food only now, no water in toilet. So sad, does the #Kerala govt have a heart. What did these Bhaktas do, does their suffering satisfy the CM's ego? #SaveSabarimala",en,"[{'screen_name': 'tvjanam', 'name': 'janam tv', 'id': '1162139910'}]",[],[],20,251,287,"['sabarimala', 'kerala', 'savesabarimala']",[],https://twitter.com/Arunakrishnan/status/1059682235287306240,False,,0,,,,,,,,[],,,,
1059681884194537473,1059681884194537473,2018-11-06 11:10:23 IST,2018-11-06,11:10:23,+0530,272801887,pratheesh_hind,Pratheesh Viswanath,,We are at the entrance of Nadapanthal itself. Will be here till Ayyappa Swamy goes back to Yoga Nidra and Temple closes. Swamy Saranam. #Sabarimala  https://t.co/loOBoUjxLk,en,[],[],['https://pbs.twimg.com/media/DrS_CccUcAA2GLC.jpg'],13,110,237,['sabarimala'],[],https://twitter.com/pratheesh_Hind/status/1059681884194537473,False,,1,https://pbs.twimg.com/media/DrS_CccUcAA2GLC.jpg,,,,,,,[],,,,
1059680771940597760,1059680771940597760,2018-11-06 11:05:58 IST,2018-11-06,11:05:58,+0530,875989950520377344,thulasirch,Thulasi 🇮🇳,,Now #Sabarimala is under control of Devotees of Lord Ayyappa...  Ayyappa Sena.... 🙇 🙇 🙇  #SaveSabarimalaTradition  #SwamiSharanam  https://t.co/Srv7IcfQTi,tl,[],[],['https://pbs.twimg.com/media/DrS-CE-VYAEYZeW.jpg'],7,101,236,"['sabarimala', 'savesabarimalatradition', 'swamisharanam']",[],https://twitter.com/thulasirch/status/1059680771940597760,False,,1,https://pbs.twimg.com/media/DrS-CE-VYAEYZeW.jpg,,,,,,,[],,,,
1059667536948559872,1059667536948559872,2018-11-06 10:13:23 IST,2018-11-06,10:13:23,+0530,63020100,arunakrishnan,Aruna Krishnan അരുണ കൃഷ്ണൻ अरुणा कृष्णन 🇮🇳,,"#Sabarimala #Kerala CM is literally persecuting Ayyappa bhaktas.A scorched earth policy is new strategy.Police stopping bhakta from going to Pamba from Nilakkal. KSRTC buses stopped Water supply stopped, no drinking water Toilets locked up No food facility Get out of Sabarimala",en,[],[],[],29,414,444,"['sabarimala', 'kerala']",[],https://twitter.com/Arunakrishnan/status/1059667536948559872,False,,0,,,,,,,,[],,,,
1059647525223784448,1059647525223784448,2018-11-06 08:53:51 IST,2018-11-06,08:53:51,+0530,249524839,kumarnandaj,J Nandakumar,,"When you focus on being a blessing, God makes sure that you are always blessed in abundance. Fortunate to have blessings from the custodian &amp; the last word of all rituals n customs related to Sabarimala, Tantri.  With Mukhya Tantri and Melsaantis of #Sabarimala n Malikappuram.  https://t.co/jG0forNuUT",en,[],[],"['https://pbs.twimg.com/media/DrSfrw3VsAIQ-rL.jpg', 'https://pbs.twimg.com/media/DrSfv_ZV4AESUMs.jpg', 'https://pbs.twimg.com/media/DrSfywJU4AAV9uz.jpg']",8,230,620,['sabarimala'],[],https://twitter.com/kumarnandaj/status/1059647525223784448,False,,1,https://pbs.twimg.com/media/DrSfrw3VsAIQ-rL.jpg,,,,,,,[],,,,
1059638274216488961,1059638274216488961,2018-11-06 08:17:06 IST,2018-11-06,08:17:06,+0530,85330272,jaypanicker,Jayashankar,,Birth Annv celebration of our erstwhile Travancore King Shri Padmanabha Dasa Shri Chithira Thirunal Balarama Varma is Today. This day is being celebrated at #Sabarimala - another reason for commie irritation  https://t.co/hH6B8pu3iz,en,[],[],['https://pbs.twimg.com/media/DrSXZB7U4AAeckk.jpg'],4,128,279,['sabarimala'],[],https://twitter.com/jaypanicker/status/1059638274216488961,False,,1,https://pbs.twimg.com/media/DrSXZB7U4AAeckk.jpg,,,,,,,[],,,,
1059632209408200704,1059632209408200704,2018-11-06 07:53:00 IST,2018-11-06,07:53:00,+0530,194516930,jaiveershergill,Jaiveer Shergill,,#BJP is not connected to religion with cord of faith but addicted to misusing religion as a “political handle” for misleading people  Planned strategy of #BJP out in open -galvanise crowds; provoke them; openly challenge Supreme Court; seek votes for next election !!  #Sabarimala,en,[],[],[],9,91,250,"['bjp', 'bjp', 'sabarimala']",[],https://twitter.com/JaiveerShergill/status/1059632209408200704,False,https://twitter.com/IndianExpress/status/1059623904312881152,0,,,,,,,,[],,,,
1059629649603452928,1059629649603452928,2018-11-06 07:42:50 IST,2018-11-06,07:42:50,+0530,57207846,rahuleaswar,Rahul Easwar,,"We #Sabarimala bhakths Will celebrate more pf  #HappyDeepavali after the Holy Temple closes after harivarasanam   1 more day of victory against anti Hindu forces who want to demean &amp;  destroy Temples &amp; places of worship   Swamy Saranam, Vandee Mataram",en,[],[],[],58,326,846,"['sabarimala', 'happydeepavali']",[],https://twitter.com/RahulEaswar/status/1059629649603452928,False,,0,,,,,,,,[],,,,
1059548235797356544,1059548235797356544,2018-11-06 02:19:19 IST,2018-11-06,02:19:19,+0530,2261350952,prafullaketkar,prafulla ketkar 🇮🇳,,"The Communist rule in Kerala is on its last legs, will end very soon. Pinarayi Vijayan is the last Communist Chief Minister in the state, said eminent historian and former chairman of ICHR Dr MGS Narayanan. #Sabarimala #SaveSabarimala   https://t.co/YJAgn0wP6V",en,[],['http://www.organiser.org/Encyc/2018/11/5/Pinarayi-Vijayan-is-the-Last-Communist-Chief-Minister-of-Kerala.html'],[],3,80,152,"['sabarimala', 'savesabarimala']",[],https://twitter.com/prafullaketkar/status/1059548235797356544,False,,0,,,,,,,,[],,,,
1059536300330680325,1059536300330680325,2018-11-06 01:31:53 IST,2018-11-06,01:31:53,+0530,55313371,nach1keta,നചികേതസ്,,"These are #Hindu #Policewomen aged 50 years and above deployed at the #Sabarimala temple today.  Look at their eyes!   You can see a #SeaOfEmotions in them.. #Devotion #Guilt #Dutiful #Helplessness..  What else can they do, except submitting themselves completely to #LordAyyappa  https://t.co/C3PfCESUvo",en,[],[],"['https://pbs.twimg.com/media/DrQxM2gXcAA0lVK.jpg', 'https://pbs.twimg.com/media/DrQxUECXcAA2XE-.jpg']",7,157,305,"['hindu', 'policewomen', 'sabarimala', 'seaofemotions', 'devotion', 'guilt', 'dutiful', 'helplessness', 'lordayyappa']",[],https://twitter.com/nach1keta/status/1059536300330680325,False,,1,https://pbs.twimg.com/media/DrQxM2gXcAA0lVK.jpg,,,,,,,[],,,,
1059527700111474689,1059527700111474689,2018-11-06 00:57:43 IST,2018-11-06,00:57:43,+0530,272801887,pratheesh_hind,Pratheesh Viswanath,,With the devotees... Without sleeping... Swamy Saranam. #Sabarimala  https://t.co/U4PS0hXN9c,en,[],[],['https://pbs.twimg.com/media/DrQy0S0U4AAX1UB.jpg'],29,284,994,['sabarimala'],[],https://twitter.com/pratheesh_Hind/status/1059527700111474689,False,,1,https://pbs.twimg.com/media/DrQy0S0U4AAX1UB.jpg,,,,,,,[],,,,
1059483074377871364,1059483074377871364,2018-11-05 22:00:23 IST,2018-11-05,22:00:23,+0530,351568421,mrvchennai,MRV,,The viciousness of Kerala govt is in stark contrast to the indifference of the central government on the #sabarimala issue. @BJP4India has let us down very badly. @narendramodi @AmitShah,en,"[{'screen_name': 'bjp4india', 'name': 'bjp', 'id': '207809313'}, {'screen_name': 'narendramodi', 'name': 'narendra modi', 'id': '18839785'}, {'screen_name': 'amitshah', 'name': 'amit shah', 'id': '1447949844'}]",[],[],18,102,169,['sabarimala'],[],https://twitter.com/MRVChennai/status/1059483074377871364,False,,0,,,,,,,,[],,,,
1059476994583232512,1059476994583232512,2018-11-05 21:36:14 IST,2018-11-05,21:36:14,+0530,1934388686,shefvaidya,Shefali Vaidya. 🇮🇳,,"Sir, the day @BJP4India govt takes steps towards making #RamMandir construction in Ayodhya a reality, and succeeds in saving #Sabarimala, I promise, I will donate 50 K to the party.",en,"[{'screen_name': 'bjp4india', 'name': 'bjp', 'id': '207809313'}]",[],[],222,984,2795,"['rammandir', 'sabarimala']",[],https://twitter.com/ShefVaidya/status/1059476994583232512,False,https://twitter.com/narendramodi/status/1059452164022558720,0,,,,,,,,[],,,,
1059475087739547650,1059475087739547650,2018-11-05 21:28:39 IST,2018-11-05,21:28:39,+0530,103805033,sureshchavhanke,Suresh Chavhanke “Sudarshan News”,,Watch @kumarnandaj ji from #Sabarimala with me #SaveSabarimala #SureshChavhankeIbSabarimala  https://t.co/f5oJFu7Tzc,en,"[{'screen_name': 'kumarnandaj', 'name': 'j nandakumar', 'id': '249524839'}]",['https://photos.app.goo.gl/yRSMMn8JWtE2krbB9'],[],9,120,382,"['sabarimala', 'savesabarimala', 'sureshchavhankeibsabarimala']",[],https://twitter.com/SureshChavhanke/status/1059475087739547650,False,,0,,,,,,,,[],,,,
1059473235090108416,1059473235090108416,2018-11-05 21:21:17 IST,2018-11-05,21:21:17,+0530,16719971,trramesh,trramesh,,"This articles spells out what happened in court today #Sabarimala row: HC raps Kerala govt, says it has no right to interfere in day-to-day affairs of shrine -  https://t.co/b1W7J3fAbk via @timesofindia @swamy39 @csranga @mrvchennai @indiccollective @surnell @vhsindia",en,"[{'screen_name': 'timesofindia', 'name': 'the times of india', 'id': '134758540'}, {'screen_name': 'swamy39', 'name': 'subramanian swamy', 'id': '60937837'}, {'screen_name': 'csranga', 'name': 'rangarajan chilkur', 'id': '278316668'}, {'screen_name': 'mrvchennai', 'name': 'mrv', 'id': '351568421'}, {'screen_name': 'indiccollective', 'name': 'indic collective', 'id': '905396695860633600'}, {'screen_name': 'surnell', 'name': 'suresh n 🇮🇳', 'id': '49877768'}, {'screen_name': 'vhsindia', 'name': 'virat hindustan sangam', 'id': '2916225752'}]",['http://toi.in/eYhQ9Z/a24gj'],[],9,185,250,['sabarimala'],[],https://twitter.com/trramesh/status/1059473235090108416,False,,0,,,,,,,,[],,,,
1059470680792518656,1059470680792518656,2018-11-05 21:11:08 IST,2018-11-05,21:11:08,+0530,249524839,kumarnandaj,J Nandakumar,,Yet another success of the Ayyappa devotees. Police at the behest of Kerala Stalin tried to oust them out of #sabarimala but the  the true bravehearts were not ready to succumb to the dirty police threats. See they occupied the pandal and started chanting SaranaMantra  https://t.co/t4dFCIyU4g,en,[],[],['https://pbs.twimg.com/media/DrP-gb5V4AABIa7.jpg'],22,414,748,['sabarimala'],[],https://twitter.com/kumarnandaj/status/1059470680792518656,False,,1,https://pbs.twimg.com/media/DrP-gb5V4AABIa7.jpg,,,,,,,[],,,,
1059470438940590080,1059470438940590080,2018-11-05 21:10:11 IST,2018-11-05,21:10:11,+0530,875989950520377344,thulasirch,Thulasi 🇮🇳,,"A devotee, having only one leg walking from Nilakkal to Pamba and heading to Sannidhanam since pinarayi police closed the roads at Nilakkal and stopped bus service. So devotees want to walk 20kms more.   #SwamiSharanam  #Sabarimala  #SaveSabarimalaTradition  #SaveSabarimala  https://t.co/5ITscVkWsR",en,[],[],['https://pbs.twimg.com/media/DrP-vM_VsAACX6z.jpg'],32,529,586,"['swamisharanam', 'sabarimala', 'savesabarimalatradition', 'savesabarimala']",[],https://twitter.com/thulasirch/status/1059470438940590080,False,,1,https://pbs.twimg.com/media/DrP-vM_VsAACX6z.jpg,,,,,,,[],,,,
1059452275897200640,1059452275897200640,2018-11-05 19:58:00 IST,2018-11-05,19:58:00,+0530,249524839,kumarnandaj,J Nandakumar,,Commi Police is blatantly violating today's Hon HC judgement. Court had unequivocally ordered that Govt shall not restrict devotees from doing Dharmik practices at #sabarimala. But now police is pushing devotees out not allowing them to see nirmalya puja &amp; perform Neyabhishekam,en,[],[],[],10,432,606,['sabarimala'],[],https://twitter.com/kumarnandaj/status/1059452275897200640,False,,0,,,,,,,,[],,,,
1059451426827632640,1059451426827632640,2018-11-05 19:54:38 IST,2018-11-05,19:54:38,+0530,220925739,sway_hi,TheAngryIndian,,"Dear @narendramodi @rsprasad @arunjaitley sirs, need to get a bill passed in parliament curtailing judiciary's vigilantism specially in national security, defence, religio-socio issues. Coz today they are interfering at #Sabarimala tomorrow they can do a coup against govt! 🙏🙏",en,"[{'screen_name': 'narendramodi', 'name': 'narendra modi', 'id': '18839785'}, {'screen_name': 'rsprasad', 'name': 'ravi shankar prasad', 'id': '2222673457'}, {'screen_name': 'arunjaitley', 'name': 'arun jaitley', 'id': '2183816041'}]",[],[],21,335,639,['sabarimala'],[],https://twitter.com/sway_hi/status/1059451426827632640,False,,0,,,,,,,,[],,,,
1059449181750779904,1059449181750779904,2018-11-05 19:45:43 IST,2018-11-05,19:45:43,+0530,501439551,nandaji1958,Nandagopal.K.M.,,Bollywood Actor Vivek Oberon at #sabarimala Lord Ayyappa's dedicated devotee. Yearly visits #SabarimalaTemple ...  https://t.co/fv5eekwjLl,en,[],[],"['https://pbs.twimg.com/media/DrPraR8V4AE7LX2.jpg', 'https://pbs.twimg.com/media/DrPrahBVYAALD2r.jpg']",5,77,275,"['sabarimala', 'sabarimalatemple']",[],https://twitter.com/nandaji1958/status/1059449181750779904,False,,1,https://pbs.twimg.com/media/DrPraR8V4AE7LX2.jpg,,,,,,,[],,,,
1059438722762960896,1059438722762960896,2018-11-05 19:04:09 IST,2018-11-05,19:04:09,+0530,272801887,pratheesh_hind,Pratheesh Viswanath,,We r at Sannidanam. Well possitioned.. All feminists think twice b4 stepping inside.. Swamy Saranam. #Sabarimala  https://t.co/xKFZ0ktsq1,en,[],[],['https://pbs.twimg.com/media/DrPh4nKVYAANzgh.jpg'],32,218,535,['sabarimala'],[],https://twitter.com/pratheesh_Hind/status/1059438722762960896,False,,1,https://pbs.twimg.com/media/DrPh4nKVYAANzgh.jpg,,,,,,,[],,,,
1059432607040049152,1059432607040049152,2018-11-05 18:39:51 IST,2018-11-05,18:39:51,+0530,2261350952,prafullaketkar,prafulla ketkar 🇮🇳,,#Sabarimala in a war-like situation: CPM’s fascism touches the roof #SabarimalaUnderArrest #SabarimalaShowdown  https://t.co/rGPD80PCw2,en,[],['http://www.organiser.org//Encyc/2018/11/5/Sabarimala-in-a-war-like-situation-CPM-s-fascism-touches-the-roof.html'],[],11,149,166,"['sabarimala', 'sabarimalaunderarrest', 'sabarimalashowdown']",[],https://twitter.com/prafullaketkar/status/1059432607040049152,False,,0,,,,,,,,[],,,,
1059427964985729026,1059427964985729026,2018-11-05 18:21:24 IST,2018-11-05,18:21:24,+0530,3240703298,shilpamdas,Shilpa Nair,,"How do u sleep Mr. Vijayan? Do u even hav a conscience?  Look at some of the pictures frm #Sabarimala. The holy abode of Ayyappa is now a Police Garrison. The Temple, which shud be thronged by devotees, is now packed wth Police Officers.   We will neither forget nor forgive, Sir.",en,[],[],[],77,472,823,['sabarimala'],[],https://twitter.com/shilpamdas/status/1059427964985729026,False,,0,,,,,,,,[],,,,
1059425920342261761,1059425920342261761,2018-11-05 18:13:17 IST,2018-11-05,18:13:17,+0530,303783976,ctravi_bjp,C T Ravi 🇮🇳 ಸಿ ಟಿ ರವಿ,,"Swami Ayyappa didn't invite you to his abode by putting up large hoardings or screaming through loudspeakers.  Neither did he send anyone with rice bags to convert you.  He existed before you or your Communism was born.  You visit #Sabarimala at the Lord's convenience, not yours.",en,[],[],[],25,891,2065,['sabarimala'],[],https://twitter.com/CTRavi_BJP/status/1059425920342261761,False,,0,,,,,,,,[],,,,
1059416341197787137,1059416341197787137,2018-11-05 17:35:13 IST,2018-11-05,17:35:13,+0530,941134694,drshamamohd,Dr. Shama Mohamed,,"A video of Kerala #BJP President  Sreedharan Pillai leaks where he is boasting that BJP planned #Sabarimala violence as it was a 'golden opportunity'.  For BJP, Sabarimala is not about faith. It is only about political opportunism!  #SabarimalaTemple   https://t.co/Y6GWNlCKTr",en,[],['https://www.thenewsminute.com/article/everyone-surrendered-our-agenda-kerala-bjp-leaders-speech-sabarimala-leaked-91095'],[],31,338,518,"['bjp', 'sabarimala', 'sabarimalatemple']",[],https://twitter.com/drshamamohd/status/1059416341197787137,False,,0,,,,,,,,[],,,,
1059410079844261888,1059410079844261888,2018-11-05 17:10:20 IST,2018-11-05,17:10:20,+0530,381891557,eorganiser,Organiser Weekly,,Pinarayi Vijayan is the Last Communist Chief Minister of Kerala: Eminent Historian and Former ICHR Chairman Dr MGS Narayanan  #Sabarimala #GoodByeCPM  https://t.co/1suTqFcF0X,en,[],['http://www.organiser.org//Encyc/2018/11/5/Pinarayi-Vijayan-is-the-Last-Communist-Chief-Minister-of-Kerala.html'],[],15,280,504,"['sabarimala', 'goodbyecpm']",[],https://twitter.com/eOrganiser/status/1059410079844261888,False,,0,,,,,,,,[],,,,
1059401235516649472,1059401235516649472,2018-11-05 16:35:11 IST,2018-11-05,16:35:11,+0530,28082599,rajeev_goi,Rajeev Chandrasekhar 🇮🇳,,Desecration - to shw no respct twrds somthng holy or much respctd.  Being @nytimes or any media isnt licnse to disrespct faith of #Sabarimala devtees undr “doing ur job”   If u hv 2 cvr story whn passions high- rspct devotees n send male reprtrs. Dnt try so hard to bcm d story.,en,"[{'screen_name': 'nytimes', 'name': 'the new york times', 'id': '807095'}]",[],[],18,73,155,['sabarimala'],[],https://twitter.com/Rajeev_GoI/status/1059401235516649472,False,https://twitter.com/anniegowen/status/1059136416935038976,0,,,,,,,,[],,,,
